,Job_Id,Emp_Type,Job_Title,Company,Date_Posted,Salary_Range,Salary_Type,Year_Experience,Seniority,Category,Requirements
75,[b'MCF-2020-0067619'],"[b'Contract, Full Time']",[b'Senior /  Research Engineer (Cybersecurity)'],[b'A*STAR RESEARCH ENTITIES'],[b'Posted 19 Mar 2020'],"[b'<div class=""lh-solid""><span class=""dib"">$3,900</span><span class=""dib""><span class=""f5 fw4 ph1"">to</span>$7,800</span></div>']",[b'Monthly'],[b'1 year  exp'],[b'Professional'],[b'Sciences / Laboratory / R&amp;D'],"['\nBachelor degree in the field of computer science, computer engineering, mathematics and statistics or electrical engineering.\nKnowledge or experience in cyber security, network security, system security and system integration.\nExperience in hackathons and/or ethical hacking is a huge plus.\nAbility to work independently to translate research ideas into programs using industry standard coding practices.\nProficient in Python, C or Java.\nBasic knowledge on data analytics and machine learning.\nAble to deliver under tight schedule.\nGood team player with both research and engineering ethics.\nGood interpersonal and communication skills.\n, \nAbility to learn\nWillingness to learn\nInterest in cyber-security domain\n']"
76,[b'MCF-2020-0067567'],"[b'Permanent, Full Time']",[b'Senior Software Development Engineer'],[b'BRIDGETEK PTE. LTD.'],[b'Posted 19 Mar 2020'],"[b'<div class=""lh-solid""><span class=""dib"">$5,000</span><span class=""dib""><span class=""f5 fw4 ph1"">to</span>$8,000</span></div>']",[b'Monthly'],[b'5 years  exp'],[b'Senior Executive'],[b'Engineering'],['']
77,[b'MCF-2020-0067178'],[b'Full Time'],[b'Software Engineer'],[b'J|S BROD PRIVATE LIMITED'],[b'Posted 19 Mar 2020'],"[b'<div class=""lh-solid""><span class=""dib"">$2,500</span><span class=""dib""><span class=""f5 fw4 ph1"">to</span>$4,000</span></div>']",[b'Monthly'],[b'4 years  exp'],[b'Professional'],[b'Information Technology'],"['\nPerform end-to-end system integration with various devices and equipment.\nProvide supporting and troubleshooting to on-site software issues.\nCollaborate with mechanical, electrical, application team to implement new hardware feature or software feature to equipment.\nDevelop and enhance software utilities to improve equipment setup and easy operating abilities.\nResponsible for software feature development and enhancement based on customer requirements.\n, \nKnowledge in Java/ J2EE/ C++/ C#/ .NET/ Python and other languages (needs to be able to learn new languages on the go).\nExperience working with IoT and perofming system integration.\nDevelopment and deployment of applications in Linux (Ubuntu/Redhat, etc).\nExperience with programming for the Web (HTTP, REST, XMLRPC, etc).\nExperience in developing real-time and distributed systems.\nExperience in using multiple IDEs - Eclipse, etc.\n']"
78,[b'MCF-2020-0066943'],"[b'Contract, Permanent, Full Time']",[b'Senior / Network Engineer'],[b'FUJITSU ASIA PTE LTD'],[b'Posted 19 Mar 2020'],"[b'<div class=""lh-solid""><span class=""dib"">$4,000</span><span class=""dib""><span class=""f5 fw4 ph1"">to</span>$9,000</span></div>']",[b'Monthly'],[b'3 years  exp'],[b'Executive'],[b'Information Technology'],"[""\nThe position is responsible for delivering billable network services by delivering superior technical solutions to all target customers, particularly in network (LAN, Data Center and WAN) solutions.\nEnsure best practice is leveraged in providing the solutions to target accounts\nEstablish structure for knowledge management so that we become a learning organisation - ensuring Fujitsu replicate success and don't repeat mistakes.\nAdvanced technical interface providing support to customers, particularly in network products such as Nexus, Catalyst, Service Provider routers, security (e.g. ASA/SourceFire, Palo Alto, Checkpoint, McAfee, Bluecoat, F5) products, transferring customers’ requirements into a solution based on Fujitsu solutions and services.\xa0 Owns technical design from concept to subsequent implementation; responsible for design, configuration, testing and commissioning of solutions.\nInvolvement in the initiative and development of industry trends – IoT, Cloud Vision and NV/SDN which is in lines with Fujitsu’s vision of Human Centric Innovation.\nResponsible for first level escalation of any deployment issues and problems. Note and escalate service development required to meet customer needs.\nEnsure adoption of Fujitsu processes, methods and tools throughout the territory.\nIdentify and create business opportunities for Fujitsu target customers and prospects.\nParticipate in the tendering process and development of proposals in line with customer needs, liaising and qualifying with other colleagues as necessary.\nPresent technical solutions to customers both formally and informally as required.\xa0 Supports in the development of customer SLAs.\nStay abreast of technical issues, options and advancements within the internetworking industry relevant to the Fujitsu services’ portfolio.\nProvide a consistently high quality (billable or non-billable) technical service to existing and new customers ensuring that customer satisfaction is maintained or improved.\nAbility to liaise with customers unaccompanied and be a recognized authority on Fujitsu products and services.\nProvision of skilled presentations to prospective customers on the technical solutions and services offered by Fujitsu with minimum support.\nResponsibility for all aspects of the technical compatibility of customer requirements with the products and services offered by Fujitsu.\nRealization of large scale and/or complex customer requirements that meet their needs and the needs of Fujitsu.\nSuccessful completion of the role will help towards increasing Fujitsu revenue and profitability.\n, \nA relevant Degree with at least 5 or more years' of experience as technical sales support in Security and network environment. Industry-recognised certifications preferred.\nGood knowledge in network systems, communications interfaces protocols, circuits, hardware and diagnostic tools.\nPossessed deployment experiences in CCNP/CCIEs (DC, R&S, Security, SP) preferred.\nGood experience on deploying security solutions such as Cisco ASA/SourceFire, Palo Alto, Checkpoint, McAfee and F5\nGood experience on deploying networks.\nHighly motivated\nTeam Player\nExcellent written and oral communication skills\nExcellent presentation skills\nSelf-starter\n""]"
79,[b'MCF-2020-0066836'],"[b'Contract, Full Time']","[b'Principal Research Engineer, I3']",[b'A*STAR RESEARCH ENTITIES'],[b'Posted 19 Mar 2020'],"[b'<div class=""lh-solid""><span class=""dib"">$7,000</span><span class=""dib""><span class=""f5 fw4 ph1"">to</span>$14,000</span></div>']",[b'Monthly'],[b'2 years  exp'],[b'Senior Executive'],[b'Sciences / Laboratory / R&amp;D'],"['\nDesign and develop embedded firmware for sensor nodes\nSupport hardware and software integration including investigating and debugging issues\nImplement efficient firmware code for low power MCU operation\nWork with RF engineer to ensure wireless data communication is reliable and accurate\nDevelop, review and document software requirements, design and code\nMaintain code depository for ease of deployment to different projects\nBS/Eng, MS/Eng in Computer Science/Engineering, or related fields\nExperience in working with C in an embedded firmware development environment, eg mbedOS and IAR systems\nSkilled in developing and deploying UART, SPI and I2C drivers\nAble to write drivers for MCU features such as DMA, RTC, IRQs, etc\nFamiliar with wireless protocols such as WiFi, BLE, LoRa\nPossess basic signal processing concepts and algorithms\nAble to implement real time operating systems (RTOS)\nHave basic understanding of electronic circuit implementation\nWorked with various ARM-based MCUs, such as STM and TI boards\nCandidate will be required to have strong critical thinking, problem solving, and excellent communication skills\n']"
80,[b'MCF-2020-0066800'],"[b'Contract, Full Time']",[b'Senior Research Fellow '],[b'NANYANG TECHNOLOGICAL UNIVERSITY'],[b'Posted 19 Mar 2020'],"[b'<div class=""lh-solid""><span class=""dib"">$6,100</span><span class=""dib""><span class=""f5 fw4 ph1"">to</span>$8,500</span></div>']",[b'Monthly'],[b'8 years  exp'],[b'Professional'],[b'Sciences / Laboratory / R&amp;D'],"['\nResponsible for conducting research on formal \xa0\xa0methods and its application on home automation systems\nResponsible for \xa0\xa0conducting research on security applied to home automation systems by means \xa0\xa0of formal methods\nResponsible for \xa0\xa0coordinating the formal methods activities in the project\n, \nPhD degree in \xa0\xa0computer science\nExpertise in \xa0\xa0software development, logic, and formal methods\nResearch experience \xa0\xa0in home automation systems, IoT security, end-user programming and related areas\nExcellent \xa0\xa0communication and writing skills\nAble to conduct \xa0\xa0research and write report independently and within teams\n']"
81,[b'JOB-2020-0000778'],[b'Contract'],[b'Digital Forensic Engineer (Specialising in Technical Research)'],[b'Public Service Division'],[b'Posted 19 Mar 2020'],"[b'<span class=""f5-5 i fw4 gray"">Salary undisclosed</span>']",[b''],[],[b''],"[b'Information Technology, Public / Civil Service']","[' Perform forensics research in the areas of mobile technologies / IoT devices / vehicle systems / Cloud services for defensive purposes Perform technical analysis on devices from the above-mentioned areas to understand the impact on forensics for these devices Maintain and perform prototyping, testing and enhancement of forensic processes and tools Perform any other digital forensic-related duties as assigned ,  Tertiary qualification in Information Technology, Computer Science, Computer Engineering, Electrical and Electronic Engineering or a related discipline Motivated and able to work independently and/or as part of a team Good analytical and conceptual abilities Relevant knowledge or experience in one or more of the following areas would be advantageous:  Experience in usage of debugger tools like GDB, LLDB in application and kernel debugging Programming experience and familiarity with languages such as Python,\xa0 Assembly and native C Knowledge of TCP/ IP, USB, wireless protocols, and experience with analysis of the protocols Knowledge of reverse engineering experience in ARM and x86 binaries Experience in usage of logic analyser, protocol analyser, oscilloscope to perform signal traffic analysis Knowledge of Android Studio,\xa0 Android SDK, Android architecture, XCode, Swift, iOS SDK, iOS architecture   ,  Experience in usage of debugger tools like GDB, LLDB in application and kernel debugging Programming experience and familiarity with languages such as Python,\xa0 Assembly and native C Knowledge of TCP/ IP, USB, wireless protocols, and experience with analysis of the protocols Knowledge of reverse engineering experience in ARM and x86 binaries Experience in usage of logic analyser, protocol analyser, oscilloscope to perform signal traffic analysis Knowledge of Android Studio,\xa0 Android SDK, Android architecture, XCode, Swift, iOS SDK, iOS architecture ']"
82,[b'MCF-2020-0067595'],"[b'Part Time, Full Time, Flexi-work']",[b'Physiotherapist'],[b'CHARIS MANOR NURSING HOME PTE. LTD.'],[b'Posted 19 Mar 2020'],"[b'<div class=""lh-solid""><span class=""dib"">$4,000</span><span class=""dib""><span class=""f5 fw4 ph1"">to</span>$8,000</span></div>']",[b'Monthly'],[b'3 years  exp'],[b'Professional'],[b'Healthcare / Pharmaceutical'],"['\nTeaching in WSQ certificate programme.\nWorking with patients with a variety of conditions, sometimes over a period of weeks or months\nDiagnosing, assessing and treating problems\nEncouraging exercise and movement\nAdvising patients on leading a healthy lifestyle\nKeeping reports on patients and their progress\nLiaising with other healthcare professionals to encourage a holistic approach to treatment\nStaying up to date with developments in treatments\nBeing caring, compassionate, and patient.\n']"
83,[b'MCF-2020-0067559'],"[b'Contract, Full Time']","[b'QA IT Specialist (US MNC, Contract, West)']",[b'MANPOWER STAFFING SERVICES (SINGAPORE) PTE LTD'],[b'Posted 19 Mar 2020'],"[b'<div class=""lh-solid""><span class=""dib"">$4,000</span><span class=""dib""><span class=""f5 fw4 ph1"">to</span>$5,600</span></div>']",[b'Monthly'],[b'5 years  exp'],[b'Senior Executive'],"[b'Healthcare / Pharmaceutical, Information Technology']","[""\nResponsible for the quality aspects of GMP computerized systems/equipment and the supporting infrastructure used in site facilities, utilities, manufacturing, packaging, labelling, and laboratories to ensure compliance with company policies, procedures and regulatory expectations.\nInvolvement in all quality-related activities for computerized systems which are required for impact on product quality, patient safety or data integrity.\nWorking closely with stakeholders and SME’s from site operations, quality operations, IT, automation and engineering to provide evidence of quality oversight throughout the computer system lifecycle and facilitate continuous improvement.\nConduct their function and roles independently, with integrity, fairness, and objectivity to protect products and patients.\nCollaborating with stakeholders (e.g. System Owners, Process Owners, Data Owners and Technical Unit) to assess and select computerized systems which enable GMP business processes.\xa0\nProviding the independent quality approval of key qualification /validation documentation such as policies, procedures, acceptance criteria, plans, protocols, requirements, reports and computerized system related changes to ensure compliance to company standards and applicable regulations throughout the computerized system lifecycle (including changes/modifications/deviations/variances/compliance investigations).\nReviewing processes and supporting documentary evidence to verify that compliance activities related to computerized systems are in place and effective.\nSupporting regulatory inspection and audit activities as needed. This includes the review of audit or inspection reports, responding to findings related to IT applications, automated manufacturing equipment, automated lab systems and infrastructure (at local sites) and taking appropriate actions to ensure GMP compliance.\n, \nBachelor's degree. Preferably in Science, Information Technology, Engineering or equivalent.\nHands-on experience and understanding of automated systems supporting pharmaceutical manufacturing, IT infrastructure and/or laboratory operations.\n5 years of experience in regulated pharmaceutical manufacturing industry. P2 range\xa0\nAt least 3 years of experience in delivering validated IT solutions or an application support role in a regulated environment.\nStrong understanding of the current pharmaceutical industry and applicable regulations with emphasis in 21 CFR Part 11, 210, 211, and 820 and local regulatory expectations.\nMust demonstrate extensive knowledge of the principles, theories and concepts of computerized system validation / compliance.\nFamiliarity and practical experience in the implementation of quality systems in a pharmaceutical, laboratory, or biotechnology manufacturing environment.\nLimited supervision required in day-to-day activities.\nProfessional Certifications (e.g. Six Sigma or certification in Project Management (PMP)\nGood understanding of applicable Engineering and/or Laboratory or Standards related to computerized systems development, implementation & Operations\nHands on experience in a Quality and/or Compliance role in a GMP environment\n, \nTuas\nContract is until the end of this year, potential to renew.\n""]"
84,[b'MCF-2020-0067026'],"[b'Contract, Full Time']","[b'Research Engineer, SMART CAMP - 3D Cell Culture (Ref: IRG_CAMP_2020_003)']",[b'SINGAPORE-MIT ALLIANCE FOR RESEARCH AND TECHNOLOGY CENTRE'],[b'Posted 19 Mar 2020'],"[b'<div class=""lh-solid""><span class=""dib"">$3,000</span><span class=""dib""><span class=""f5 fw4 ph1"">to</span>$4,500</span></div>']",[b'Monthly'],[b'1 year  exp'],[b'Junior Executive'],[b'Sciences / Laboratory / R&amp;D'],"['\nPrimary responsibility for all aspects of mammalian cell culture, including media and buffer preparation, culture initiation, propagation, and cryopreservation of cells, including primary human cells from commercial and/or patient sources as well as adherence to quality control schedules for ensuring consistency of cell culture materials.\nPerform molecular biology techniques such as RNAi, pharmacology on cells, basic laboratory protocol studies, including basic calculations and data analysis.\nAccurate and reliable record keeping including database management, batch records, notebooks, and all pertinent documentation.\nSterile preparation of laboratory glassware, tools, and reagents.\nPerformance of general laboratory tasks, including maintenance of equipment.\nGenerate graphs, figures and reports as necessary.\nWork with other members of the team on bioanalytics and data interpretation.\n, \nBachelor’s degree in biological/biochemistry/biotechnology or other relevant discipline.\nStrong hands-on ability to carry out standard mammalian cell culture and related assays and experiments\nExperience using basic laboratory equipment and carrying our routine laboratory tasks; knowledge of safe laboratory procedures.\nGood communication skills to work with researchers from biological / clinical backgrounds\nGood writing skills in preparing reports, and journal publications\nAble and committed to work in Singapore\n']"
85,[b'MCF-2020-0065943'],"[b'Contract, Permanent, Full Time']",[b'Software Engineer'],[b'THALES DIS (SINGAPORE) PTE. LTD.'],[b'Posted 18 Mar 2020'],"[b'<div class=""lh-solid""><span class=""dib"">$3,400</span><span class=""dib""><span class=""f5 fw4 ph1"">to</span>$5,100</span></div>']",[b'Monthly'],[b'1 year  exp'],[b'Executive'],[b'Engineering'],"['\nDevelop, validate and deploy new software components (for example advance software security mechanism and next generation IoT connectivity protocols) for embedded operating systems targeted for mobile and IoT devices, in applications such as mobile payment and IoT connectivity\nParticipate to the development of next generation operating systems for future devices\nBeing in agile development environment to work closely within team and multiple teams around the world to build great products exceeding customer expectations\nContribute to continuous product and development methodology improvement\n, \nDegree in Electrical/Electronics/Computer Engineering, or related fields\nProficient in C/Java programming languages\n1st professional experience or internship within embedded software development area preferred\nKnowledge of embedded technologies/ecosystem, software security or Javacard knowledge is a plus\n']"
86,[b'MCF-2020-0065945'],"[b'Permanent, Full Time']",[b'Assistant Mechatronics Engineer'],[b'WONG FONG ENGINEERING WORKS (1988) PTE LTD'],[b'Posted 18 Mar 2020'],"[b'<div class=""lh-solid""><span class=""dib"">$2,500</span><span class=""dib""><span class=""f5 fw4 ph1"">to</span>$3,000</span></div>']",[b'Monthly'],[b'1 year  exp'],[b'Junior Executive'],"[b'Engineering, Sciences / Laboratory / R&amp;D']",['']
87,[b'MCF-2020-0066215'],[b'Full Time'],[b'Project Manager - BI  /  DW  /  Analytics'],[b'ERNST &amp; YOUNG ADVISORY PTE. LTD.'],[b'Posted 18 Mar 2020'],"[b'<div class=""lh-solid""><span class=""dib"">$7,000</span><span class=""dib""><span class=""f5 fw4 ph1"">to</span>$12,000</span></div>']",[b'Monthly'],[b'8 years  exp'],[b'Manager'],"[b'Consulting, Information Technology']",['']
88,[b'MCF-2020-0065885'],"[b'Contract, Full Time']","[b'Scientist (High Performance Computing), Computing &amp; Intelligence, IHPC']",[b'A*STAR RESEARCH ENTITIES'],[b'Posted 18 Mar 2020'],"[b'<div class=""lh-solid""><span class=""dib"">$4,500</span><span class=""dib""><span class=""f5 fw4 ph1"">to</span>$9,000</span></div>']",[b'Monthly'],[],[b'Professional'],"[b'Engineering, Information Technology, Sciences / Laboratory / R&amp;D']","['\nPhD \xa0in Computer Science/Engineering or equivalent with proven research \xa0expertise\nHave \xa0conducted impactful system research in one or more of the following areas: high \xa0performance computing, machine learning, parallel and distributed computing, \xa0storage, database, IoT and etc.\nGood \xa0programming skills: multi-language (C++, C#, Java, Python, CUDA programming); \xa0network programming (TCP/IP Socket), parallel programming (multi-thread, OpenMP \xa0and MPI).\nKnowledge \xa0background and project experience on machine learning models and platforms \xa0(e.g., TensorFlow and PyTorch).\nHands-on \xa0experiences in computer system and network, Linux OS, virtualization platforms \xa0(e.g., Xen, KVM and Docker), cloud computing, distributed system, storage and \xa0database will be an added advantage\nUnderstanding \xa0of HPC applications and industry experience\xa0is preferred\n']"
89,[b'MCF-2020-0066417'],[b'Full Time'],[b'Aquaculture Technician'],[b'APOLLO AQUACULTURE GROUP PRIVATE LIMITED'],[b'Posted 18 Mar 2020'],"[b'<div class=""lh-solid""><span class=""dib"">$2,000</span><span class=""dib""><span class=""f5 fw4 ph1"">to</span>$4,000</span></div>']",[b'Monthly'],[b'1 year  exp'],[b'Executive'],[b'Sciences / Laboratory / R&amp;D'],"['\nHands-on work with live-feed production.\nSupport fish larvae production.\nAssist in R&D activities relating to live-feed and larvae production.\nSupport broodstock management.\n, \nITE / Diploma in Aquaculture / Biotechnology & related field\nPassion with the aquaculture industry\nPossess MS Office Application skills\nAble to work independently\nGood time management skills\n']"
90,[b'MCF-2020-0066394'],[b'Contract'],[b'QA IT Specialist (Contract)'],[b'MANPOWER STAFFING SERVICES (SINGAPORE) PTE LTD'],[b'Posted 18 Mar 2020'],"[b'<div class=""lh-solid""><span class=""dib"">$5,500</span><span class=""dib""><span class=""f5 fw4 ph1"">to</span>$6,500</span></div>']",[b'Monthly'],[b'5 years  exp'],[b'Senior Executive'],"[b'Engineering, Healthcare / Pharmaceutical, Information Technology, Manufacturing, Sciences / Laboratory / R&amp;D']",['']
91,[b'MCF-2020-0066294'],"[b'Permanent, Full Time']",[b'Lab IT System Engineer'],[b'ZENTEK ENGINEERING PTE. LTD.'],[b'Posted 18 Mar 2020'],"[b'<div class=""lh-solid""><span class=""dib"">$3,500</span><span class=""dib""><span class=""f5 fw4 ph1"">to</span>$5,000</span></div>']",[b'Monthly'],[],[b'Junior Executive'],"[b'Healthcare / Pharmaceutical, Information Technology']","['\nInstall and configure software and hardware used in Laboratory\nManage day-to-day operational users support\nProvide monitoring and \xa0\xa0\xa0\xa0\xa0maintenance support for Laboratory computer system\nTroubleshoot issues and outages\nUpgrade systems with new releases and models\nDevelop technical documentation, manuals and IT policies\nSupport deployment and validation projects for laboratory computer system\n, \nBachelor’s degree/Diploma in Computer Science, IT or any related discipline. Fresh Degree in Computer Science or Computer Engineering are welcomed.\nPrior experience in an GxP-related environment in a Biotech or Pharmaceutical company with computer system validation experience is a plus\nExperience with Laboratory Computer System Support an advantage\nFamiliarity with various operating systems and platforms, databases and software development life cycle (SDLC) an advantage\nResourcefulness and problem-solving aptitude\nSelf-motivated and positive with high degree of initiative and excellent follow-up skills, along with strong analytical and problem-solving skills\nExcellent interpersonal, verbal and written communication and presentation skills\nComfortable in a fast-paced environment with minimal direction\n']"
92,[b'MCF-2020-0066210'],"[b'Permanent, Full Time']",[b'Treasury Dealer'],"[b'E.SUN COMMERCIAL BANK, LTD.']",[b'Posted 18 Mar 2020'],"[b'<div class=""lh-solid""><span class=""dib"">$5,000</span><span class=""dib""><span class=""f5 fw4 ph1"">to</span>$9,000</span></div>']",[b'Monthly'],[b'5 years  exp'],[b'Senior Executive'],[b'Banking and Finance'],"['\nTo analyze capital market and seek suitable target for investment by fixed income instrument\nTo prepare periodic reports to the branch and Head Office\nTo assist Head of Treasury to monitor all liquidity requirements in compliance with internal and external regulations\nTo analyze major countries monetary policies and perform gapping operations and arbitrage opportunities in Money Market\nTo send market updates and trade ideas based on market movements\nAssist with the development and expansion of Treasury Business\nKepp abreast of regulations and cross check rules prior to deal execution\n, \nBachelor degre in Finance, economics, commerce or engineering\nAt least 5 years experience in interest rate, FX, FX iotion or commodity derivaties (sales/ structuring)\nKnowledge of FX business\nKnowledge of Vanilla Derivative Products - IRS/ CCS/ Simple interest rate and FX options\nTeam player\nGood command of written and spoken English and Mandarin\n']"
93,[b'MCF-2020-0066131'],[b'Full Time'],[b'Osteopath / Physiotherapist / Clinical Research'],[b'ORCHARD HEALTH CLINIC PTE. LTD.'],[b'Posted 18 Mar 2020'],"[b'<div class=""lh-solid""><span class=""dib"">$4,000</span><span class=""dib""><span class=""f5 fw4 ph1"">to</span>$5,000</span></div>']",[b'Monthly'],[b'2 years  exp'],[b'Fresh/entry level'],"[b'Healthcare / Pharmaceutical, Medical / Therapy Services, Professional Services']",['']
