Job_Id,Emp_Type,Job_Title,Company,Date_Posted,Year_Experience,Seniority,Category,Requirements,Min_Salary,Max_Salary,Avg_Salary,Salary_range,Qualification,New_Skills
MCF-2020-0071809,Permanent,Data Scientist,IBM INNOVATION SERVICES PTE. LTD.,Posted 26 Mar 2020,3,Professional,Information Technology,You lead designing processes analyse structured unstructured data sources insights Collaborate services subject matter experts (SMEs) drive analytical You enable ensuring applying data intelligence Identify new data sources interpret findings analysis experiments IBM teams stakeholders Develop models analysis across range Quote Cash functions Design tracking actions analyse impact business outcomes implementation deployment analytics Design efficient Spark Monitor Spark performance A Degree quantitative field (Statistics Mathematics Operations Research Economics Bioinformatics Computer Science ). A research quantitative field plus. 3-5 working data sets models Strong statistical Excellent understanding machine learning techniques algorithms Logistic Regression Decision Trees Random Forrest Support Vector Machines Clustering Expertise various data ( .e. CRISP-DM & engineering well evaluation validation) Experience libraries R Python (NumPy Pandas Scikit) SQL noSQL Scala Weka MatLab Experience data visualization techniques tools Cognos Analytics Tableau Plotly Familiarity data science limited IBM Cloud products (e.g. Watson Assistant Watson Studio Bluemix ) Knowledge data mining data Great communication (oral written) strong player Ability techniques fast- Ability problems Experience NoSQL databases Cloudant MongoDB Cassandra HBase Experience tools like Hadoop stack Spark Pig Hive . Experience working Linux scripting languages Bash Experience Deep Learning frameworks TensorFlow Caffe CNTK Torch DL4J,6500.0,12000.0,9250.0,High,%degree%computer science%engineering%statistic%math%business,python%scala%hadoop%sql%spark%tensorflow%scikit%linux%caffe%deep learning%cassandra%tableau%pandas%hive%machine learning%bash%cloud%bash
MCF-2020-0072203,Permanent,Data Engineer,PUMAS AUTOMATION & ROBOTICS PTE LTD,Posted 26 Mar 2020,2,Professional,Consulting Engineering Information Technology,Develop architecture IIoT data ingestion processing solutions. Provide customers data analytics intelligence. Engineer infrastructure big- real- detection . Background computer science engineering. Ability data . Deep predictive data analytics. Industry data science -structured non- . Good Python . Additional JavaScript REST Java .net plus. Good understanding software development life cycle requirements testing deployment. Sound Machine Learning (ML) building Deep Learning (DL) models plus. Experience plus. Exposure Big eg. Cassandra Hadoop Apache Spark. Previous exposure IaaS platforms Azure Google AWS.,3500.0,6000.0,4750.0,Med,%computer science%engineering,python%java%scala%hadoop%spark%deep learning%apache%aws%azure%cassandra%machine learning%.net
MCF-2020-0072360,Contract Permanent,Senior Research Engineer (Computer Science),NANYANG TECHNOLOGICAL UNIVERSITY,Posted 26 Mar 2020,5,Manager,Information Technology,Data mining documents insights identify patterns Design intelligence (AI) machine learning (ML) engines - experiments Application AI ML information retrieval (IR) Conduct research apply state- - - scale real Documentation Mentoring PhD computer science Minimum 5 software development Experience background AI ML data science Passionate AI- applications Proficient one programming languages (e.g. Python C/C++ .) /modules Experience large- processing analytics Good publication,5500.0,8250.0,6875.0,High,phd%computer science,python%c++%machine learning
MCF-2020-0071969,Contract Permanent,Senior Research Engineer (Computer Science),NANYANG TECHNOLOGICAL UNIVERSITY,Posted 26 Mar 2020,5,Manager,Information Technology,Design language processing (NLP) algorithms models analysis e.g. - resolution Application NLP information retrieval (IR) Conduct research apply state- - - scale real Documentation Mentoring PhD computer science Minimum 5 software development Experience background NLP Passionate NLP AI applications Proficient one programming languages (e.g. Python C/C++ .) /modules Experience large- processing analytics Good publication,5500.0,8250.0,6875.0,High,phd%computer science,python%nlp%c++%natural language
MCF-2020-0071269,Permanent,Software Architect (Data Science),YOJEE PTE. LTD.,Posted 25 Mar 2020,2,Executive,Engineering,Prototyping & learning algorithms cutting problems finding planning NP- . Build maintain scalable data pipeline data . Basic preparation. Build analysis visualisation . Build solutions Big Data technologies data respond real time. Minimum Bachelor Degree Computer Science Computer Engineering equivalent . Minimum 2 machine learning data analysis. Proficient software programming database Python Scala Java SQL scikit-learn MapReduce Spark Apache Hadoop. Knowledge Big Data Frameworks Spark Hadoop . Proficient statistical models Regression Clustering Classification . Experience working agile software development practices. Ability distributed . Singaporeans PRs apply position. Scikit-learn. Machine learning . Scala Java. Proficient statistical models Regression Clustering Classification .,5700.0,7400.0,6550.0,High,%degree%computer science%engineering%statistic%computer engineering%business,python%java%scala%hadoop%sql%spark%scikit%apache%mapreduce%agile%machine learning
MCF-2020-0070847,Permanent,Manager (Data Security) (JD#5939),SCIENTE INTERNATIONAL PTE. LTD.,Posted 25 Mar 2020,5,Manager,Information Technology,Degree Computer Science Engineering Information Technology Information Security Data Science Minimum 3 relevant Data standards Good Information Security Governance Risk Management Compliance Regulatory Knowledge challenges Some Ability articulate enterprise data vision translate steps Well stakeholder management excellent communication Should proactive . CISSP CISM CISA Experience data science data platforms. Design implement data processes Work Data Security policies support Enterprise Data Ecosystem Ensure enterprise assess risk ( ) involved Understand data flows/ data sources support enhancement transformation data use Engage stakeholders practices Work Security Practitioners .,4500.0,8000.0,6250.0,High,%degree%computer science%engineering,
MCF-2020-0070901,Contract Permanent,Data Scientist (Scientific Infrastructure and Analytics) ICES,A*STAR RESEARCH ENTITIES,Posted 25 Mar 2020,2,Non-executive,Sciences  Laboratory  R&D,Work researchers establish data model chemistry/process development Collaborate IT establish data completeness data. Apply build analytics scientific . Work management develop strategy limited identifying needed chemistry/ search visualizations self-service. Work researchers create ICES Act application process modeling support catalyst chemistry/process development. Support building data- data- data- analysis Be methods apply business techniques models Actively internal external business IT network PhD Masters Degree Science Computer Science . (Experience 2-5 (PhD) 5 (Masters) Ability operations technology problems apply high degree innovation. Working large data management analysis well strategies visualization communication Strong foundation statistical data management data visualization science. Knowledge programming languages platforms R Python JAVA C++ Python .NET SQL Working artificial including Artificial Neural Networks (ANNs) Genetic Algorithms (GAs) Swarm Intelligence Multi-objective Optimizations Fuzzy Logic Systems Good understanding chemistry desirable Excellent communication oral written Flexibility demands responsibilities Ability plan/ tasks documentation Ability efficiently multi- -,4500.0,9000.0,6750.0,High,phd%master%degree%computer science%engineering%statistic%business,python%java%sql%c++%optimization%.net
MCF-2020-0071259,Permanent,Manager Digital Experience - Global Finance,JOHNSON & JOHNSON PTE. LTD.,Posted 25 Mar 2020,5,Manager,Information Technology,Identify user requirements project developers Formulate use Develop Human Centric experiences Understanding data Science capabilities Recommendation Engine collaboration Manage engage SMEs internal stakeholders IT development partners Drive innovation experimentation Iterative testing Work stakeholders management resolution Define management Maintain features Digital Platform Governance Keep - -date trends space data analytics data science 5 8 relevant UX human- Experience Design Thinking / Human- Design Operational -set data problem-solving complexity Proven track record ownership . Ability variety Exceptional interpersonal communication ( written verbal) . Experience technical non- across Energetic problem-solving deal point necessary Working BI platform Strong program Strong sense ownership done Good -functional Advanced quantitative analytical Structured thinking strong problem- Result oriented driven Working understanding Agile methodology Individual preferred must Ability lead teamwork drive common goals achievements Good written,8000.0,16000.0,12000.0,High,,%scala%git%agile
MCF-2020-0071117,Permanent,Lead Data Scientist (Fintech),MANPOWER STAFFING SERVICES (SINGAPORE) PTE LTD,Posted 25 Mar 2020,7,Manager,Consulting Information Technology Sciences  Laboratory  R&D,Lead development validation high- machine features solutions real- Contribute product features Guide mentor multi-disciplined Data Science Data Engineering research-oriented implementation scale Work fast-paced environment communicate effectively Working Singapore needed 7 relevant including 1 exposure FinTech Minimum Masters PhD equivalent quantitative field (Computer Science Mathematics Engineering Artificial Intelligence .) Advanced statistical machine learning models: Logistic Regression Support Vector Machines XGBoost Deep Learning models (CNNs/RNNs) Proficient scikit-learn Python Pandas Hadoop Spark SQL . Proficiency Amazon Web Services Proficiency Neo4J OrientDB AllegroGraph JanusDB . Additional proficiency Natural Language Processing Additional proficiency Keras TensorFlow Caffe Torch/PyTorch Spark MLlib Deep Learning framework Track record delivering end end.,8000.0,10000.0,9000.0,High,phd%master%computer science%engineering%statistic%math,python%hadoop%sql%spark%tensorflow%scikit%pytorch%caffe%deep learning%pandas%machine learning%natural language%keras
MCF-2020-0071562,Contract Permanent,Digital Product Specialist (Banking),OPTIMUM SOLUTIONS (SINGAPORE) PTE LTD,Posted 25 Mar 2020,8,Professional,Information Technology,Masters fundamentals capabilities CUSTOMER JOURNEY .e. Customer Experience & Journey optimization Products Services Channel / Segment Optimization Business IT Delivery Develops phases products services well New product/ service product/ lead . (New) risk compliance Improvements new ideas implementations. Customer Uses / technical expertise contribute events ( ) Applies / service develop maintain customers Keeps track developments ( area methods ) Weighs development new products services sub-products. Initiates Prioritizes role Digital Studio lead Monitors requirements Minimum 7-10 banking project understanding Minimum 3-5 requirements user engineering data science software engineering Background UX preferred Experience Product Owner / Product Manager Strong software development lifecycle Experience Agile methodologies Strong leadership Excellent communication presentation high degree comfort speaking Must player Strong analytical quantitative Demonstrated think Brings high-energy job influence around Able build sense comfortable & Passion innovation attitude,10000.0,12000.0,11000.0,High,%master%degree%engineering%business,%git%agile%optimization
MCF-2020-0070394,Contract Permanent,IT - Data Science Analyst,NTT DATA SINGAPORE PTE. LTD.,Posted 24 Mar 2020,1,Executive,Information Technology,A university degree higher Statistics/ Data Science/ Computing/Engineering A understanding data analysis machine learning NLP concepts Python Pyspark Spark SQL/mysql Hadoop -system (Hive HDFS Pig .) End end data deployment production environment Familiarity Linux system Knowledge software development life Experience time Experience unstructured data sources analysis,5000.0,8500.0,6750.0,High,%degree%engineering%statistic,python%hadoop%sql%spark%linux%nlp%hive%machine learning
MCF-2020-0070586,Permanent,Senior Staff Data Scientist,SEAGATE SINGAPORE INTERNATIONAL HEADQUARTERS PTE. LTD.,Posted 24 Mar 2020,7,Professional,Engineering Manufacturing Sciences  Laboratory  R&D,Work subject matter experts questions development visualizations techniques inDataMining Machine Learning Statistics Execute Industry 4.0 Prognostics Health Management projects Seagate APAC Operations stakeholders Technical lead data science projects area Deep Learning Develop data mining exploration Design develop machine learning deep learning algorithms Leverage / machine learning methods problems Quantify value subject matter experts Provide staff Highly proficient Python SQL R Solid technical machine learning deep learning data mining data structures Hands- Keras Tensorflow XGBoost CNN GAN RNN Time Series Analysis Experience full- development. Knowledge Hadoop Spark. Ability infrastructure Version Git. Understanding software practices Demonstrate Leadership Ability lead staff close Teamwork self-motivated. Self-starter. Ability influence. Ability well environment Strong oral written communication . Strong analysis clear A well native non-native English Able participate conference hours Working : Industrial IoT Sensing & Devices Predictive Maintenance Prognostics & Health Management Industry 4.0 . Knowledge Time-series analysis Thesis research topics predictive analytics - time-series language intelligence machine learning Proficiency Java JavaScript would plus,7000.0,14000.0,10500.0,High,%statistic%business,python%java%hadoop%sql%spark%tensorflow%deep learning%git%machine learning%natural language%cloud%keras
MCF-2020-0070323,Permanent,Finance Associate,NETFLIX PTE. LTD.,Posted 24 Mar 2020,5,Executive,Banking  Finance,The Associate report Manager Content Strategy & Analysis Southeast Asia based Singapore partner go- Southeast Asia Content Team. Preparing deal analyses ( testing .) partnership Creative Business Affairs teams Conducting market Southeast Asia Conducting analysis key trends Regularly reports - - leaders Compiling post- analyses optimization improvement Working cross- CS&A well Product Marketing Consumer Insights Data Science teams Candidates required Candidates fast-paced intellectual results integrity ethics. Candidates must flexible 2-5 / media/ / strategy/business development/ . We worked highly- analysis Prior Media/Entertainment plus Prior Southeast Asian markets High aptitude strong Excel Familiarity analysis Adept High proficiency MS Excel & PowerPoint working statistics Bachelor degree mathematics statistics relevant field English Bahasa / Thai,12000.0,15000.0,13500.0,High,%degree%statistic%math%business,%optimization
MCF-2020-0068996,Permanent,Data Science & AI Training Instructor,SEAGATE SINGAPORE INTERNATIONAL HEADQUARTERS PTE. LTD.,Posted 23 Mar 2020,5,Senior Executive,Engineering Manufacturing Sciences  Laboratory  R&D Others,Be Evangelist area data science advanced analytics grow Seagate Be Head Coach CDS . Ability CDS learning solving data science techniques Design maintain program Be subject (SME) program Work closely Program Manager develop Conduct workshops Programs participants. Prepare solutions. Share data best practices Develop AI Trainer Program Create lead blog Monitor respond queries Provide support queries Complete ad- required Act part certification Be required conference hours communicate stakeholders Good oral written communication . Ability clear CDS Certification Program participants Effective organizational time management Demonstrated professional ethics A self-starter. Ability well environment A well native non-native English Experienced data scientist passionate teaching Highly proficient - Python Python libraries SQL R TensorFlow Hands- software KNIME Good understanding Hadoop Spark AWS Azure Containerization Edge Compute Solid technical machine learning deep learning data Relevant Data Science/Analytics Relevant / delivering Data Science/Analytics training plus. Ability,5000.0,8000.0,6500.0,High,%statistic,python%hadoop%sql%spark%tensorflow%deep learning%aws%azure%container%machine learning
MCF-2020-0069198,Permanent,Principal (Data / AI / Analytic),INFOSYS CONSULTING PTE. LTD.,Posted 23 Mar 2020,10,Middle Management,Consulting,Demonstrated Digital/Data/AI Analytics AI/Data Scientist/Data Insights: To analytics business strategies artificial intelligence(AI) machine learning data science business intelligence. Ability sets data sets visualization data analytics tools like SAS SQL Adobe Tableau Qlikview MSBI In- ecosystem including ( limited ) process business Experience advisory financial services / Telcos Ability information / help execution improve products value client business Ability sets data/information information Data Strategist/Strategy Data Transformation - Expertise implementation AI/Analytics/data data data security. Experience part / budget management controls risks issues / Experience Consulting . Understanding assets. Conceptualise data Assess BI/EPM develop - architecture business case Own outcomes Understanding data modelling big data real-time data Masters management . Manages value client Infosys. Reports risks. Functional domains- IoT AI Blockchain AR/VR Cloud Machine Learning Data Management Data architecture. Leads teams Establishes deployment delivery area Begins leadership IP Develops specialization. Builds Bachelors degree Economics Engineering Strategy Statistics advanced degree (Masters MBA PhD .) preferred Relevant e.g. customer strategy journey segmentation advanced model process cost IT . Tertiary qualifications marketing . Analytical Skills: Ability findings - . Collaborative social: Must people. Exceptional Communication . Strong Problem Solving Skills:See world clients. Relationship Management-Build clients internal stakeholders,10000.0,14000.0,12000.0,High,phd%master%degree%computer science%engineering%statistic%business,%sql%tableau%sas%git%machine learning%cloud%optimization%qlik
MCF-2020-0069190,Permanent,Senior Principal (Data / AI / Analytics),INFOSYS CONSULTING PTE. LTD.,Posted 23 Mar 2020,10,Middle Management,Consulting,Demonstrated Digital/Data/AI Analytics AI/Data Scientist/Data Insights: To analytics business strategies artificial intelligence(AI) machine learning data science business intelligence. Ability sets data sets visualization data analytics tools like SAS SQL Adobe Tableau Qlikview MSBI In- ecosystem including ( limited ) process business Experience advisory financial services / Telcos Ability information / help execution improve products value client business Ability sets data/information information Data Strategist/Strategy Data Transformation - Expertise implementation AI/Analytics/data data data security. Experience part / budget management controls risks issues / Experience Consulting . Understanding assets. Conceptualise data Assess BI/EPM develop - architecture business case Own outcomes Understanding data modelling big data real-time data Lead delivery domains- IoT AI Blockchain AR/VR Cloud Machine Learning Data Management Data architecture. Represents Infosys client interactions client Manages Establishes builds IP offerings Coaches project members hard . Adjusts style approach get individual Opens conversations new lead opportunities. Presents effectively self others Masters . Delivers . Delivers Bachelors degree Economics Engineering Strategy Statistics advanced degree (Masters MBA PhD .) preferred Relevant e.g. customer strategy journey segmentation advanced model process cost IT . Tertiary qualifications marketing . Analytical Skills: Ability findings - . Collaborative social: Must people. Exceptional Communication . Strong Problem Solving Skills:See world clients. Relationship Management-Build clients internal stakeholders,13000.0,18000.0,15500.0,High,phd%master%degree%computer science%engineering%statistic%business,%sql%tableau%sas%git%machine learning%cloud%optimization%qlik
MCF-2020-0069107,Permanent,A1 Support Engineer,DATAROBOT SINGAPORE PTE. LTD.,Posted 23 Mar 2020,3,Professional,Information Technology,Respond customers DataRobot Platform Triage problems DataRobot Platform Work DataRobot subject matter scientists engineers issues Assist develop support Design services platform Learn DataRobot Platform techniques Document Develop career data science Experience enterprise SaaS products AWS Experience procedures Data Analyst Data Operations working BI tools. Experience SQL R Python Experience working Linux Strong verbal written communication 3+ analytical technical passion learn Bachelor degree relevant field (Computer Science Statistics Math) equivalent A degree computer science data science Experience Jupyter Anaconda Experience Data Science Data Analyst Data Operations working big data. Respond customers DataRobot Platform Triage problems DataRobot Platform Work DataRobot subject matter scientists engineers issues Assist develop support Design services platform Learn DataRobot Platform techniques Document Develop career data science,5000.0,12500.0,8750.0,High,%degree%computer science%statistic%math,python%sql%linux%aws%jupyter
MCF-2020-0069476,Permanent,Data Scientist,PALO IT SINGAPORE PTE. LTD.,Posted 23 Mar 2020,3,Executive,Consulting Information Technology,Identify use AI & Machine Define data fit clients state- - -art methods solve problems efficient manner Build statistical machine learning techniques patterns large data sets Communicate potential improvement Evaluate third emerging technologies (e.g. deep learning NLP) Collaborate clients Palo IT practices build - - gather data features ML algorithms well machine data- Participate development assets/ Contribute thought leadership research You BachelorMaster PhD degree Computer Science Statistics discipline performance analytic required You 3 working Good supervised/ learning techniques algorithms Good applied languages RPython(NumPy pandas) SAS SPSS . Experience machine learning frameworks(e.g scikit-learn SparkMLlibCaffe TensorFlow) / data (e.g. SAS Dataiku) Data- SQLdata wrangling data modelling Exposure tools / (eg. Tableau Qlik D3.js GGplot) Willingness data science techniques deep learning NLP... Willingness part multi- business problems end- -end,5000.0,8000.0,6500.0,High,phd%master%degree%computer science%statistic%business,python%sql%spark%tensorflow%scikit%caffe%deep learning%nlp%tableau%sas%pandas%machine learning%qlik%d3.js
MCF-2020-0069641,Permanent,Project Manager (Visual Communication),NANYANG TECHNOLOGICAL UNIVERSITY,Posted 23 Mar 2020,5,Professional,Sciences  Laboratory  R&D,Oversee Centres AI Apps (Android iOS) Drive Apps Pursue integration AI Unity based IntelliK platform Prepare Centre Director Bachelor degree Fine Arts (Visual Communication) Background art Experience managing Unity projects Minimum 5 relevant academic,4200.0,6200.0,5200.0,Med,%degree,%git
MCF-2020-0068885,Contract Permanent,Software Architect (Special Projects) AI3 A*STAR,A*STAR RESEARCH ENTITIES,Posted 22 Mar 2020,15,Manager,Engineering Sciences  Laboratory  R&D,Key drive required developing delivery Manage software well ensure quality . Provide Develop Software Design Document well -components Technology Readiness Level Develop -flows achieve 15+ Bachelor degree Electrical/Electronics/Computer Engineering. Technical data management/artificial Project management Multi-stakeholder management People- Strong programming quantitative (e.g. statistical analysis) Ability independently,7900.0,13800.0,10850.0,High,%degree%engineering%statistic%computer engineering,
MCF-2020-0067896,Permanent,Data Science Lead,WIPRO LIMITED (SINGAPORE BRANCH),Posted 20 Mar 2020,7,Professional,Information Technology,Manage data science machine learning Bigdata Project delivery Interpret problems Build predictive models Test performance data- Visualize data Experiment techniques Align organizational goals Overall 7-10 Solid understanding machine learning Data Scientist Build Features raw data come data Knowledge data management visualization techniques Good Pyspark XGBoost Scikitlearn Tensorflow Experience SQL NoSQL databases Strong organizational leadership Degree Computer Science Data Science,5000.0,10000.0,7500.0,High,%degree%computer science,%sql%spark%tensorflow%scikit%machine learning
MCF-2020-0067824,Permanent,Data Engineer,TALENT STORK PTE. LTD.,Posted 20 Mar 2020,5,Junior Executive,Information Technology,Personally involved development . Designing developing scaling big data technologies . Build analytics tools data pipeline insights key metrics. Build transformation loading data data sources SQL AWS big data technologies. Assemble large complex data sets / non- requirements. Engage directly key understand business strategies . Identify : - scalability . Experience designing data models efficiency quality data. Programming programming languages : C C++ Java Perl Python Experience building data pipeline data analytics solutions. Strong driven understand data. Knowledge writing Advanced SQLs performance tuning SQLs. Database development Relational MPP/distributed systems Oracle/Teradata/Vertica/Hadoop Experience data science machine /technologies plus.,5000.0,7000.0,6000.0,Med,%business,python%java%scala%hadoop%sql%perl%aws%c++%machine learning%oracle
