Job_Id,Emp_Type,Job_Title,Company,Date_Posted,Year_Experience,Seniority,Category,Requirements,Min_Salary,Max_Salary,Avg_Salary,Salary_range,Qualification,New_Skills
MCF-2020-0072069,Permanent,Java Software Engineer Payments Technology - Associate,JPMORGAN CHASE BANK N.A.,Posted 26 Mar 2020,5,Executive,Information Technology,BS/BA degree equivalent Advanced application data infrastructure architecture disciplines Understanding architecture across systems Working proficiency developmental toolsets Knowledge industry wide technology trends best practices Ability large collaborative teams achieve organizational goals passionate building innovative culture Proficiency one modern programming languages Understanding Business Functional Specifications Understanding existing program logic Providing / agreeing estimates required development Creation/ update Detailed Design Specifications Program Specifications program Version Control documentation Coding new programs changes existing programs Get code reviewed leads SMEs Creation Unit Test Plans execution Unit Tests Preparation execution Systems Test Plans Scripts Providing technical support Quality Assurance (QA) Testing Providing technical support User Acceptance Testing Creation Implementation/ Back Plans Support Handover Documents Providing technical support Production Implementations post-implementation support implementation warranty period Experience working Eclipse / Maven environments Demonstrate Junit unit testing Hands fine tuning application response / performance testing Experience Web Services Experience Mule MQ / JMS (message transfer process) Experience version control tool GIT Understanding banking risk compliance policies Experience code scanning tools like black duck tools like Sonar Knowledge Microsoft Project Word Excel applications Experience development financial applications including financial transaction processing settlement accounting Familiarity SWIFT (Society Worldwide Interbank Financial Telecommunication) Message formats,6000.0,12000.0,9000.0,High,%degree%business,%git
MCF-2020-0072515,Contract Permanent,ELK Engineer,CAPITA PTE. LTD.,Posted 26 Mar 2020,5,Senior Executive,Information Technology,Develop operate optimize performance IT reliable decision making. Build scalable reliable ETL pipelines processes data data sources. Work -real- application cases API- cases. Build BI web applications insights dashboards . Support databases Elasticsearch. Deploy manage data dashboards Troubleshooting issues focus end users. Applying best practices scaling . Good developer language preferably Python SQL Real passion data technologies solutions Experience implementation operation ELK stack mandatory. Experience ELK Machine Learning Module preferred. Show track record end- - ELK projects ELK dashboard. Experience tools Ansible Terraform . Knowledge management tools like Kubernetes . Experience building services Experience tools (e.g. Nagios Prometheus) plus. Experience Splunk plus.,4500.0,9000.0,6750.0,High,,python%scala%sql%container%machine learning%api%.net
MCF-2020-0070808,Contract Permanent,Senior Lead Specialist,INTEGRATED HEALTH INFORMATION SYSTEMS PTE. LTD.,Posted 25 Mar 2020,10,Manager,Information Technology,Assists conceptualization analytical projects Maintain project plans status reports incoming active projects Provide subject matter expertise stakeholders throughout whole analytics lifecycle Prepare documentation outline data sources models algorithms used developer Drive data collection efforts Assist developing new data-discovery tools Extract data data sources Propose new uses existing data sources structures Integrate multiple data sets build large complex data sets Apply programming abilities build software scrub combine manage data variety sources Apply data mining techniques programming investigate leads identify patterns regularities data Develop data models based advanced statistical modelling data mining machine learning methods Implement automated processes efficiently producing scale models Identify improvement current processes products/services analytical models Assist development actionable recommendations Develop compelling logically structured presentations including story telling research/analytics findings Guide stakeholders act findings PHD/Masters/Bachelors Economics Statistics/Biostatistics/Bioinformatics Mathematics Operation Research Physics quantitative disciplines. Minimum 10 experienced Data Egnineering Data Analyst Data Scientist Data Visualiser Deep understanding statistical modelling machine learning data mining text mining concepts track record solving problems methods. Proficient tools R/SAS/SPSS/Phyton. Excellent communication relationship strong player. Experience big data techniques ( Hadoop MapReduce Hive Pig Spark) deep learning BI/Visualisation tool ( Informatica MS SQL SQL OBIEE Tableau D3.js) plus.,6700.0,12730.0,9715.0,High,phd%master%statistic%math,%hadoop%sql%spark%deep learning%mapreduce%tableau%sas%hive%machine learning%d3.js
MCF-2020-0070807,Contract Permanent,Lead Specialist,INTEGRATED HEALTH INFORMATION SYSTEMS PTE. LTD.,Posted 25 Mar 2020,8,Manager,Information Technology,Assists conceptualization analytical projects Maintain project plans status reports incoming active projects Provide subject matter expertise stakeholders throughout whole analytics lifecycle Prepare documentation outline data sources models algorithms used developer Drive data collection efforts Assist developing new data-discovery tools Extract data data sources Propose new uses existing data sources structures Integrate multiple data sets build large complex data sets Apply programming abilities build software scrub combine manage data variety sources Apply data mining techniques programming investigate leads identify patterns regularities data Develop data models based advanced statistical modelling data mining machine learning methods Implement automated processes efficiently producing scale models Identify improvement current processes products/services analytical models Assist development actionable recommendations Develop compelling logically structured presentations including story telling research/analytics findings Guide stakeholders act findings PHD/Masters/Bachelors Economics Statistics/Biostatistics/Bioinformatics Mathematics Operation Research Physics quantitative disciplines. Minimum 8 experienced Data Egnineering Data Analyst Data Scientist Data Visualiser Deep understanding statistical modelling machine learning data mining text mining concepts track record solving problems methods. Proficient tools R/SAS/SPSS/Phyton. Excellent communication relationship strong player. Experience big data techniques ( Hadoop MapReduce Hive Pig Spark) deep learning BI/Visualisation tool ( Informatica MS SQL SQL OBIEE Tableau D3.js) plus.,5500.0,10450.0,7975.0,High,phd%master%statistic%math,%hadoop%sql%spark%deep learning%mapreduce%tableau%sas%hive%machine learning%d3.js
MCF-2020-0070806,Contract Permanent,Senior Specialist,INTEGRATED HEALTH INFORMATION SYSTEMS PTE. LTD.,Posted 25 Mar 2020,6,Manager,Information Technology,Assists conceptualization analytical projects Maintain project plans status reports incoming active projects Provide subject matter expertise stakeholders throughout whole analytics lifecycle Prepare documentation outline data sources models algorithms used developer Drive data collection efforts Assist developing new data-discovery tools Extract data data sources Propose new uses existing data sources structures Integrate multiple data sets build large complex data sets Apply programming abilities build software scrub combine manage data variety sources Apply data mining techniques programming investigate leads identify patterns regularities data Develop data models based advanced statistical modelling data mining machine . Implement automated processes efficiently producing scale models Identify improvement current processes products/services analytical models Assist development actionable recommendations Develop compelling logically structured presentations including story telling research/analytics findings Guide stakeholders act findings PHD/Masters/Bachelors Economics Statistics/Biostatistics/Bioinformatics Mathematics Operation Research Physics quantitative disciplines. Minimum 6 experienced Data Egnineering Data Analyst Data Scientist Data Visualiser Deep understanding statistical modelling machine learning data mining text mining concepts track record solving problems methods. Proficient tools R/SAS/SPSS/Phyton. Excellent communication relationship strong player. Experience big data techniques ( Hadoop MapReduce Hive Pig Spark) deep learning BI/Visualisation tool ( Informatica MS SQL SQL OBIEE Tableau D3.js) plus.,4500.0,8550.0,6525.0,High,phd%master%statistic%math,%hadoop%sql%spark%deep learning%mapreduce%tableau%sas%hive%machine learning%d3.js
MCF-2020-0070805,Contract Permanent,Senior Specialist,INTEGRATED HEALTH INFORMATION SYSTEMS PTE. LTD.,Posted 25 Mar 2020,4,Senior Executive,Information Technology,Assists conceptualization analytical projects Maintain project plans status reports incoming active projects Provide subject matter expertise stakeholders throughout whole analytics lifecycle Prepare documentation outline data sources models algorithms used developer Drive data collection efforts Assist developing new data-discovery tools Extract data data sources Propose new uses existing data sources structures Integrate multiple data sets build large complex data sets Apply programming abilities build software scrub combine manage data variety sources Apply data mining techniques programming investigate leads identify patterns regularities data Develop data models based advanced statistical modelling data mining machine learning methods Implement automated processes efficiently producing scale models Identify improvement current processes products/services analytical models Assist development actionable recommendations Develop compelling logically structured presentations including story telling research/analytics findings Guide stakeholders act findings PHD/Masters/Bachelors Economics Statistics/Biostatistics/Bioinformatics Mathematics Operation Research Physics quantitative disciplines. Minimum 4 experienced Data Egnineering Data Analyst Data Scientist Data Visualiser Deep understanding statistical modelling machine learning data mining text mining concepts track record solving problems methods. Proficient tools R/SAS/SPSS/Phyton. Excellent communication relationship strong player. Experience big data techniques ( Hadoop MapReduce Hive Pig Spark) deep learning BI/Visualisation tool ( Informatica MS SQL SQL OBIEE Tableau D3.js) plus.,3600.0,6840.0,5220.0,Med,phd%master%statistic%math,%hadoop%sql%spark%deep learning%mapreduce%tableau%sas%hive%machine learning%d3.js
MCF-2020-0070804,Contract Permanent,Specialist,INTEGRATED HEALTH INFORMATION SYSTEMS PTE. LTD.,Posted 25 Mar 2020,1,Fresh/entry level,Information Technology,Assists conceptualization analytical projects Maintain project plans status reports incoming active projects Provide subject matter expertise stakeholders throughout whole analytics lifecycle Prepare documentation outline data sources models algorithms used developer Drive data collection efforts Assist developing new data-discovery tools Extract data data sources Propose new uses existing data sources structures Integrate multiple data sets build large complex data sets Apply programming abilities build software scrub combine manage data variety sources Apply data mining techniques programming investigate leads identify patterns regularities data Develop data models based advanced statistical modelling data mining machine learning methods Implement automated processes efficiently producing scale models Identify improvement current processes products/services analytical models Assist development actionable recommendations Develop compelling logically structured presentations including story telling research/analytics findings Guide stakeholders act findings PHD/Masters/Bachelors Economics Statistics/Biostatistics/Bioinformatics Mathematics Operation Research Physics quantitative disciplines. Deep understanding statistical modelling machine learning data mining text mining concepts track record solving problems methods. Proficient tools R/SAS/SPSS/Phyton. Excellent communication relationship strong player. Experience big data techniques ( Hadoop MapReduce Hive Pig Spark) deep learning BI/Visualisation tool ( Informatica MS SQL SQL OBIEE Tableau D3.js) plus.,3300.0,6270.0,4785.0,Med,phd%master%statistic%math,%hadoop%sql%spark%deep learning%mapreduce%tableau%sas%hive%machine learning%d3.js
MCF-2020-0071364,Permanent,Research Associate (Natural Language Processing),NANYANG TECHNOLOGICAL UNIVERSITY,Posted 25 Mar 2020,1,Professional,Sciences  Laboratory  R&D,Algorithmic development natural language processing (NLP) techniques algorithms Collaborating Research Fellow Generating top- publications journals conferences Perform - Master degree Electrical/Electronics/Computer Engineering/Mathematics area NLP Strong development engineering Deep Learning platforms (Tensorflow / Pytorch) Familiar natural language processing machine learning,3500.0,5300.0,4400.0,Low,%master%degree%engineering%math%computer engineering,%tensorflow%pytorch%deep learning%nlp%machine learning%natural language
MCF-2020-0071636,Permanent,DevOps Engineer (Network),FCS CAREERS PTE. LTD.,Posted 25 Mar 2020,3,Executive,Information Technology Telecommunications,Develop applications Understand order use-cases Manage process prototype production Ensure best practices followed Track solutions Identify systems Provide analysis company. Degree Diploma Computer Science discipline Excellent - exposure Python PHP JavaScript RESTful APIs JSON YAML Well- Unix/Linux OS Familiarity relational databases SQL data structures Able Agile understanding SDLC Comfortable CI/CD working DevOps mindset Knowledge TCP/IP . would Some exposure machine learning processing real-time (NRT) plus Excellent communication proficiency English Possess strong sense initiative independently . Attractive benefits Exciting dynamic environment.,4500.0,6500.0,5500.0,Med,%degree%computer science,python%java%sql%linux%agile%machine learning%api%unix%.net
MCF-2020-0071549,Permanent,Data Engineer,KINGFISHER RECRUITMENT (SINGAPORE) PTE. LTD.,Posted 25 Mar 2020,2,Junior Executive,Information Technology,At 1 coding Python SQL JavaScript. At 2 Visualisation tools Tableau QlikSense PowerBI . At 2 DWH techniques ( ) . At 2 developing Machine Learning -based DWH Experience Python backend Frameworks Completed 1 data Front- (HTML/ CSS/ JavaScript JavaScript frameworks (e.g. angular) visualization libraries D3 Kibana I2),3500.0,5000.0,4250.0,Low,,python%java%sql%tableau%machine learning%qlik
MCF-2020-0071172,Permanent,Collections Manager,FACEBOOK SINGAPORE PTE. LTD.,Posted 25 Mar 2020,10,Professional,Banking  Finance,Lead APAC Collections managing day improvements Develop execute initiatives customers market Engineering implementation tools Work closely vendors & metrics improvements SLA Partner Facebook development terms & Other initiatives area Bachelors degree + relevant managing APAC Collections operations leadership role Experience - - company Proven managing diverse leadership passion Highly collaborative player regional Experience working systems & tools technologies analytics machine Strong business management effectively stakeholders customers C- Experience / working BPO models Ability operate fast-paced environment well highly-,10000.0,15000.0,12500.0,High,%degree%engineering%business,%git%machine learning
MCF-2020-0070843,Permanent,Data Engineer,SCIENTEC CONSULTING PTE. LTD.,Posted 25 Mar 2020,3,Executive,Information Technology,Develop test maintain warehouses large- processing systems Design develop data pipelines/systems data production Ensure data architecture ad- data analytics stakeholders business Leverage variety programming languages / highly available use descriptive Recommend improve data flexibility efficiency Discover opportunities primary sources Ensure stored information access Bachelor Master degree Computer Science Computer Engineering Information Systems At 5 working data architecture data warehousing ETL/ELT At 3 working AWS familiar solutions EC2 S3 EMR Redshift Athena Kinesis Advanced programming Java Hadoop Apache Spark Scala Hive Pig Hands- data data Hands- /unstructured/ - Programming Python R SQL processing Experience data pipeline implementation ETL/ELT In-depth MPP techniques Ability algorithms learning & statistical models plus Excellent verbal English Chinese Excellent time management Team player,4000.0,5500.0,4750.0,Med,%master%degree%computer science%engineering%statistic%computer engineering%business,python%java%scala%hadoop%sql%spark%apache%aws%hive%machine learning%cloud%optimization
MCF-2020-0070552,Permanent,Senior Data Scientist,SEAGATE SINGAPORE INTERNATIONAL HEADQUARTERS PTE. LTD.,Posted 24 Mar 2020,5,Senior Executive,Engineering Manufacturing Sciences  Laboratory  R&D Others,Focus Seagate advanced analytics projects Image Analytics Develop data mining exploration Design develop machine learning deep learning algorithms Deliver advanced analytics solutions: natural language processing visualization . Apply CNN GAN RNN Time Series Analysis XGBoost Keras Tensorflow analytics solutions insights Industry-proven Python C/C++ C# Hands application Python OpenCV Numpy Matplotlib Outstanding technical problem solving debugging Self-motivated learn execute attention detail documentation execution Ability ambiguity Teamwork self-motivated Fast Effective oral written communication Self-starter influence Ability well environment A well native non-native English Able participate conference hours Outstanding technical problem solving debugging Self-motivated learn execute attention detail documentation execution Ability ambiguity Related working computer vision/image Working project Azure DevOps: Planning & Execution Management (Kanban Boards Scrum Sprints) Version Control (Git) Documentation (Wiki Sphinx) Automated Test/Continuous Integration (Pipelines Jenkins *CI similar) Added - Machine Learning GPU optimizations UI frameworks DevOps / Infrastructure Software QA,5800.0,12000.0,8900.0,High,,python%tensorflow%deep learning%azure%c++%git%machine learning%natural language%optimization%c#%opencv%computer vision%keras%scrum
MCF-2020-0070538,Permanent,Staff Data Scientist,SEAGATE SINGAPORE INTERNATIONAL HEADQUARTERS PTE. LTD.,Posted 24 Mar 2020,6,Professional,Engineering Manufacturing Sciences  Laboratory  R&D Others,Focus Seagate advanced analytics projects Image Analytics Develop data mining exploration Design develop machine learning deep learning algorithms Deliver advanced analytics solutions: natural language processing visualization . Apply CNN GAN RNN Time Series Analysis XGBoost Keras Tensorflow analytics solutions insights Industry-proven Python C/C++ C# Hands application Python OpenCV Numpy Matplotlib Outstanding technical problem solving debugging Self-motivated learn execute attention detail documentation execution Ability ambiguity Teamwork self-motivated Fast Effective oral written communication Self-starter influence Ability well environment A well native non-native English Able participate conference hours Outstanding technical problem solving debugging Self-motivated learn execute attention detail documentation execution Ability ambiguity Related working computer vision/image Working project Azure DevOps: Planning & Execution Management (Kanban Boards Scrum Sprints) Version Control (Git) Documentation (Wiki Sphinx) Automated Test/Continuous Integration (Pipelines Jenkins *CI similar) Added - Machine Learning GPU optimizations UI frameworks DevOps / Infrastructure Software QA,6000.0,12000.0,9000.0,High,,python%tensorflow%deep learning%azure%c++%git%machine learning%natural language%optimization%c#%opencv%computer vision%keras%scrum
MCF-2020-0070686,Permanent,Sr Applied Research Engineer Search Science - Apple Media Products,APPLE SOUTH ASIA PTE. LTD.,Posted 24 Mar 2020,1,Professional,Engineering,5+ relevant industry Experience Search Natural Language Processing Machine Learning Experience data pipelines Hadoop Java Scala Spark Passion. Our Apple want engineers Preferred Skills: Deep understanding search information retrieval ranking Experience solutions Lucene / Solr / Elasticsearch Familiarity A/B experimentation data/metric- development You Have search & discover Apple Media content Apple . Be part software engineering information mining machine systems (Hadoop Scala Spark). Be responsible . Use big evaluate . Conduct AB Tests ensure . Ensure data models production. Work collaboration world- researchers ensure features models . Work Natural Language Processing (NLP) Tokenization Stemming Lemmatization Synonym mining Improve Search Recall Text Indexing Query Rewrites Design & Implement solutions integration tests integration delivery. Support search:,10000.0,20000.0,15000.0,High,%engineering%statistic,%java%scala%hadoop%spark%nlp%machine learning%natural language
MCF-2020-0070628,Permanent,Research Engineer (Computer Science / Computer Engineering),NANYANG TECHNOLOGICAL UNIVERSITY,Posted 24 Mar 2020,1,Professional,Sciences  Laboratory  R&D,Carry research field Implement machine learning algorithms analytics techniques Write papers requirements projects Present workshops Masters degree Computer Science Computer Engineering Good background deep learning reinforcement learning models ANN CNN efficient CNN Good understanding experiences Good communication writing English,3500.0,5300.0,4400.0,Low,%master%degree%computer science%engineering%computer engineering,%deep learning%machine learning
MCF-2020-0070706,Contract Permanent,Tier 3 Application Support End User Services Associate,JPMORGAN CHASE BANK N.A.,Posted 24 Mar 2020,6,Executive,Banking  Finance,BS/BA degree equivalent Basic application development Working one general purpose programming interest learning needed Working develop maintain Ability collaboratively teams relationships goals,6000.0,12000.0,9000.0,High,%degree,
MCF-2020-0070484,Permanent,Java Software Engineer Payments Strategy - Associate,JPMORGAN CHASE BANK N.A.,Posted 24 Mar 2020,5,Executive,Information Technology,Candidate possess Bachelor Degree Post Graduate Diploma Professional Degree Engineering (Computer/Telecommunication) Computer Science/Information Technology equivalent. At 5 Java - Min 5 tuning strong Experience working NoSQL databases Cassandra Knowledge RESTful APIs Working messaging - UM Kafka Good understanding ISO20022 standard Familiar UNIX operating system scripting Strong analytical troubleshooting Good communication Able independently multi task,7000.0,14000.0,10500.0,High,%degree%computer science%engineering,%java%sql%kafka%cassandra%api%unix
MCF-2020-0070477,Permanent,Java Software Engineer Payments Strategy - Associate,JPMORGAN CHASE BANK N.A.,Posted 24 Mar 2020,5,Executive,Information Technology,Candidate possess Bachelor Degree Post Graduate Diploma Professional Degree Engineering (Computer/Telecommunication) Computer Science/Information Technology equivalent. At 5 Java - Min 5 tuning strong Experience working NoSQL databases Cassandra Knowledge RESTful APIs Working messaging - UM Kafka Good understanding ISO20022 standard Familiar UNIX operating system scripting Strong analytical troubleshooting Good communication Able independently multi task,6000.0,12000.0,9000.0,High,%degree%computer science%engineering,%java%sql%kafka%cassandra%api%unix
MCF-2020-0070341,Permanent,Senior Developer,RAKUTEN ASIA PTE. LTD.,Posted 24 Mar 2020,3,Professional,Engineering,Discuss understand business requirements Able efficiency Develop business requirements Integrate solutions including SAP web devices sensors Work machine learning AI IOT low- platforms Actively new products technologies process users Be part Identify success A degree Computer Science Engineering More 3 working software development Able Able integration process Experience working IOT technologies AI technology Able operate environment,6000.0,8000.0,7000.0,High,%degree%computer science%engineering%business,%machine learning
MCF-2020-0070465,Permanent,Project Manager APAC Payments Technology - Vice President,JPMORGAN CHASE BANK N.A.,Posted 24 Mar 2020,10,Senior Executive,Information Technology,BS/BA degree equivalent Expert business business lines business Understanding global line program methods Experience working high-performing teams execution A strong understanding Waterfall Agile management operations Ability create maintain relationships stakeholders throughout firm Experience stakeholders order meet Knowledge APAC Payments end SWIFT ISO20022 APAC Clearers Ability ensure solution fit purpose,7500.0,15000.0,11250.0,High,%degree%business,%agile
MCF-2020-0070453,Permanent,Project Manager APAC Payments Technology - Vice President,JPMORGAN CHASE BANK N.A.,Posted 24 Mar 2020,10,Senior Executive,Information Technology,BS/BA degree equivalent Expert business business lines business Understanding global line program methods Experience working high-performing teams execution A strong understanding Waterfall Agile management operations Ability create maintain relationships stakeholders throughout firm Experience stakeholders order meet Knowledge APAC Payments end SWIFT ISO20022 APAC Clearers Ability ensure solution fit purpose,7500.0,15000.0,11250.0,High,%degree%business,%agile
